{
  "schema": 1,
  "version": "0.2.1",
  "sequence": 4,
  "generatedAt": "2026-10-30T20:42:48.781Z",
  "expiresAt": "2027-10-30T20:42:48.781Z",
  "plugins": [
    {
      "id": "kai.assistant",
      "name": "KAI Assistant",
      "description": "The original KAI chat workspace, advanced agents and research, desktop providers, voice and animated desktop companion.",
      "version": "0.2.0",
      "apiVersion": 2,
      "minCoreVersion": "0.5.0",
      "repository": "therexdev/kai-plugin-assistant",
      "url": "https://github.com/therexdev/kai-plugin-assistant/releases/download/v0.2.0/kai-plugin-assistant-0.2.0.kaiplugin",
      "publicKey": "MCowBQYDK2VwAyEAujPt2xYcqLkorZIdmrBEa0ZlLml+yEERDhP+YtI2t5o=",
      "fingerprint": "c0f3c78f6e5a04d9ff4a4d8702ac8e2a66a7f9f0cad3287c46a80823304be440",
      "sha256": "556c6f6878a1d9299150cc150dde04e98e731d8f074c9acba261da8b12292e02",
      "permissions": [
        "models.read",
        "inference.local",
        "storage.read",
        "storage.write",
        "assistant.read",
        "assistant.write",
        "assistant.chat",
        "assistant.native",
        "assistant.network",
        "assistant.media",
        "desktop.preferences"
      ]
    },
    {
      "id": "kai.brain",
      "name": "Brain",
      "description": "The original complete Brain workspace: memories, graph, goals, sources, awareness, orchestration and your existing encrypted data.",
      "version": "0.2.0",
      "apiVersion": 2,
      "minCoreVersion": "0.5.0",
      "repository": "therexdev/kai-plugin-brain",
      "url": "https://github.com/therexdev/kai-plugin-brain/releases/download/v0.2.0/kai-plugin-brain-0.2.0.kaiplugin",
      "publicKey": "MCowBQYDK2VwAyEAujPt2xYcqLkorZIdmrBEa0ZlLml+yEERDhP+YtI2t5o=",
      "fingerprint": "c0f3c78f6e5a04d9ff4a4d8702ac8e2a66a7f9f0cad3287c46a80823304be440",
      "sha256": "e6251dcbdfbb33db09f54da8a24707cf4da2a644635012d82bbd44c1b245aa84",
      "permissions": [
        "brain.read",
        "brain.write",
        "brain.import",
        "brain.export",
        "desktop.navigate",
        "desktop.external",
        "brain.workflow"
      ]
    },
    {
      "id": "kai.connections",
      "name": "KAI Connections",
      "description": "The original complete Connections workspace: app catalog, account sign-in, selected actions, custom APIs and encrypted credentials.",
      "version": "0.2.0",
      "apiVersion": 2,
      "minCoreVersion": "0.5.0",
      "repository": "therexdev/kai-plugin-connections",
      "url": "https://github.com/therexdev/kai-plugin-connections/releases/download/v0.2.0/kai-plugin-connections-0.2.0.kaiplugin",
      "publicKey": "MCowBQYDK2VwAyEAujPt2xYcqLkorZIdmrBEa0ZlLml+yEERDhP+YtI2t5o=",
      "fingerprint": "c0f3c78f6e5a04d9ff4a4d8702ac8e2a66a7f9f0cad3287c46a80823304be440",
      "sha256": "6dbf8e3baad915daca3f5f878e85ece8f79bc420cbaa1c1e8edb4788f4082e8b",
      "permissions": [
        "connections.read",
        "connections.manage",
        "connections.execute",
        "desktop.navigate",
        "desktop.external",
        "connections.brain"
      ]
    },
    {
      "id": "kai.workflows",
      "name": "Workflows",
      "description": "The original workflow builder and runtime: reusable agents, full graphs, schedules, event triggers, tools, connections, approvals and run history.",
      "version": "0.2.1",
      "apiVersion": 2,
      "minCoreVersion": "0.5.0",
      "repository": "therexdev/kai-plugin-workflows",
      "url": "https://github.com/therexdev/kai-plugin-workflows/releases/download/v0.2.1/kai-plugin-workflows-0.2.1.kaiplugin",
      "publicKey": "MCowBQYDK2VwAyEAujPt2xYcqLkorZIdmrBEa0ZlLml+yEERDhP+YtI2t5o=",
      "fingerprint": "c0f3c78f6e5a04d9ff4a4d8702ac8e2a66a7f9f0cad3287c46a80823304be440",
      "sha256": "ddf4f48f0d0de249ceaf7f0a93477074dfc6797d53131279865b7e991658a910",
      "permissions": [
        "models.read",
        "workflows.read",
        "workflows.write",
        "workflows.run"
      ]
    },
    {
      "id": "kai.agent-network",
      "name": "Agent Network",
      "description": "Create isolated private AI services, share signed invitations, discover configured relays, and review free service jobs. Paid rentals are not enabled.",
      "version": "0.2.1",
      "apiVersion": 2,
      "minCoreVersion": "0.5.0",
      "repository": "therexdev/kai-plugin-agent-network",
      "url": "https://github.com/therexdev/kai-plugin-agent-network/releases/download/v0.2.1/kai-plugin-agent-network-0.2.1.kaiplugin",
      "publicKey": "MCowBQYDK2VwAyEAujPt2xYcqLkorZIdmrBEa0ZlLml+yEERDhP+YtI2t5o=",
      "fingerprint": "c0f3c78f6e5a04d9ff4a4d8702ac8e2a66a7f9f0cad3287c46a80823304be440",
      "sha256": "8afdf5a16fba7f78280567eb2be374d37bd9d72b1a832efab0e2fede067daf0d",
      "permissions": [
        "models.read",
        "agent-network.read",
        "agent-network.write",
        "agent-network.manage",
        "agent-network.network"
      ]
    },
    {
      "id": "kai.documents",
      "name": "Documents",
      "description": "The original local writing workspace with autosave, selection-aware AI edits, streamed suggestions, Apply/Discard/Stop, and native document import/export.",
      "version": "0.2.0",
      "apiVersion": 2,
      "minCoreVersion": "0.5.0",
      "repository": "therexdev/kai-plugin-documents",
      "url": "https://github.com/therexdev/kai-plugin-documents/releases/download/v0.2.0/kai-plugin-documents-0.2.0.kaiplugin",
      "publicKey": "MCowBQYDK2VwAyEAujPt2xYcqLkorZIdmrBEa0ZlLml+yEERDhP+YtI2t5o=",
      "fingerprint": "c0f3c78f6e5a04d9ff4a4d8702ac8e2a66a7f9f0cad3287c46a80823304be440",
      "sha256": "f4367f504ae618376fd3ad32d9899046f600a013510fe65565d5a6ee0ad9767f",
      "permissions": [
        "models.read",
        "documents.read",
        "documents.write",
        "documents.import",
        "documents.export",
        "documents.draft",
        "desktop.preferences"
      ]
    },
    {
      "id": "kai.model-compare",
      "name": "KAI Model Compare",
      "description": "The original blind A/B model comparison: prompt presets, local and network models, streaming responses, timings, reveal and saved voting scores.",
      "version": "0.2.0",
      "apiVersion": 2,
      "minCoreVersion": "0.5.0",
      "repository": "therexdev/kai-plugin-model-compare",
      "url": "https://github.com/therexdev/kai-plugin-model-compare/releases/download/v0.2.0/kai-plugin-model-compare-0.2.0.kaiplugin",
      "publicKey": "MCowBQYDK2VwAyEAujPt2xYcqLkorZIdmrBEa0ZlLml+yEERDhP+YtI2t5o=",
      "fingerprint": "c0f3c78f6e5a04d9ff4a4d8702ac8e2a66a7f9f0cad3287c46a80823304be440",
      "sha256": "0346af4cf2438d903a37c3f933c97e86153b45239db91aec0d3257ad3795fb8b",
      "permissions": [
        "models.read",
        "inference.local",
        "storage.read",
        "storage.write",
        "compare.run",
        "desktop.preferences"
      ]
    },
    {
      "id": "kai.code",
      "name": "Koinos Code",
      "description": "The complete original coding workspace: projects and conversations, plan-first coding, reviewed file changes and commands, project tools, slash commands, and GitHub.",
      "version": "0.2.0",
      "apiVersion": 2,
      "minCoreVersion": "0.5.0",
      "repository": "therexdev/kai-plugin-code",
      "url": "https://github.com/therexdev/kai-plugin-code/releases/download/v0.2.0/kai-plugin-code-0.2.0.kaiplugin",
      "publicKey": "MCowBQYDK2VwAyEAujPt2xYcqLkorZIdmrBEa0ZlLml+yEERDhP+YtI2t5o=",
      "fingerprint": "c0f3c78f6e5a04d9ff4a4d8702ac8e2a66a7f9f0cad3287c46a80823304be440",
      "sha256": "0fb96625b61d975599f2cb583b16a53fc1b1961edb0b6b41f7373341c6280814",
      "permissions": [
        "models.read",
        "code.read",
        "code.assist",
        "code.write",
        "code.execute",
        "desktop.preferences",
        "storage.read",
        "storage.write"
      ]
    },
    {
      "id": "kai.tools",
      "name": "KAI Tools",
      "description": "The original Tools and Developer Tools workspaces: MCP, email, calendar, saved agent teams, pipelines, playground and benchmarks.",
      "version": "0.2.0",
      "apiVersion": 2,
      "minCoreVersion": "0.5.0",
      "repository": "therexdev/kai-plugin-tools",
      "url": "https://github.com/therexdev/kai-plugin-tools/releases/download/v0.2.0/kai-plugin-tools-0.2.0.kaiplugin",
      "publicKey": "MCowBQYDK2VwAyEAujPt2xYcqLkorZIdmrBEa0ZlLml+yEERDhP+YtI2t5o=",
      "fingerprint": "c0f3c78f6e5a04d9ff4a4d8702ac8e2a66a7f9f0cad3287c46a80823304be440",
      "sha256": "6419ee666b34b86753db324da496c4286e54744754f0bfa66e179d33e8d66738",
      "permissions": [
        "tools.read",
        "tools.manage",
        "tools.execute"
      ]
    },
    {
      "id": "kai.koinos-node",
      "name": "KAI Koinos Node",
      "description": "The complete Koinos Node workspace: wallet, funding, block production, external signing, quick sync, recovery and reward history.",
      "version": "0.2.0",
      "apiVersion": 2,
      "minCoreVersion": "0.5.0",
      "repository": "therexdev/kai-plugin-koinos-node",
      "url": "https://github.com/therexdev/kai-plugin-koinos-node/releases/download/v0.2.0/kai-plugin-koinos-node-0.2.0.kaiplugin",
      "publicKey": "MCowBQYDK2VwAyEAujPt2xYcqLkorZIdmrBEa0ZlLml+yEERDhP+YtI2t5o=",
      "fingerprint": "c0f3c78f6e5a04d9ff4a4d8702ac8e2a66a7f9f0cad3287c46a80823304be440",
      "sha256": "6dd652d671d9f8d24b3e12c11419dbc925c1aae470c71cb3b2d84bc95d9c14a4",
      "permissions": [
        "koinos-node.read",
        "koinos-node.manage",
        "koinos-node.wallet",
        "koinos-node.fund"
      ]
    },
    {
      "id": "kai.remote-access",
      "name": "KAI Remote Access",
      "description": "The original Local API workspace with API keys, budgets, usage, privacy controls and optional remote relay access.",
      "version": "0.2.1",
      "apiVersion": 2,
      "minCoreVersion": "0.6.1",
      "repository": "therexdev/kai-plugin-remote-access",